,Unnamed: 0,Title,Director,Actors,Rating,Revenue (Millions),fb_likes,yt_likes_ratio,Top actor followers,Director Followers
790,790,Sisters,Jason Moore,"Amy Poehler, Tina Fey, Maya Rudolph, Ike Barinholtz",6.0,87.03,419636,14.04340567612688,128715.0,771.0
791,791,The Family,Luc Besson,"Robert De Niro, Michelle Pfeiffer, Dianna Agron, John D'Leo",6.3,36.92,295187,5.5,2023552.0,1459277.0
792,792,Zack and Miri Make a Porno,Kevin Smith,"Seth Rogen, Elizabeth Banks, Craig Robinson, Gerry Bednob",6.6,31.45,113,6.454545454545454,7491281.0,3347186.0
793,793,Ma vie de Courgette,Claude Barras,"Gaspard Schlatter, Sixtine Murat, Paulin Jaccoud,Michel Vuillermoz",7.8,0.29,3977,24.423076923076927,24.0,13.0
794,794,Man on a Ledge,Asger Leth,"Sam Worthington, Elizabeth Banks, Jamie Bell, Mandy Gonzalez",6.6,18.6,448084,25.315789473684212,2351911.0,10.0
795,795,No Strings Attached,Ivan Reitman,"Natalie Portman, Ashton Kutcher, Kevin Kline, Cary Elwes",6.2,70.63,1925,0.0,19090373.0,1838.0
796,796,Rescue Dawn,Werner Herzog,"Christian Bale, Steve Zahn, Jeremy Davies, Zach Grenier",7.3,5.48,1000230,15.021739130434785,3716.0,96.0
797,797,Despicable Me 2,Pierre Coffin,"Steve Carell, Kristen Wiig, Benjamin Bratt, Miranda Cosgrove",7.4,368.05,18224739,10.253464203233257,5362389.0,18.0
798,798,A Walk Among the Tombstones,Scott Frank,"Liam Neeson, Dan Stevens, David Harbour, Boyd Holbrook",6.5,25.98,322653,6.812108559498956,893605.0,46.0
799,799,The World's End,Edgar Wright,"Simon Pegg, Nick Frost, Martin Freeman, Rosamund Pike",7.0,26.0,267113,20.987249544626593,6501452.0,738110.0
801,801,Seven Psychopaths,Martin McDonagh,"Colin Farrell, Woody Harrelson, Sam Rockwell,Christopher Walken",7.2,14.99,6488,42.885135135135144,23995.0,0.0
802,802,Beowulf,Robert Zemeckis,"Ray Winstone, Crispin Glover, Angelina Jolie,Robin Wright",6.2,82.16,10897,7.1015625,59031.0,16.0
803,803,Jack Ryan: Shadow Recruit,Kenneth Branagh,"Chris Pine, Kevin Costner, Keira Knightley,Kenneth Branagh",6.2,50.55,140729,13.558536585365855,1800.0,1078.0
804,804,1408,Mikael Håfström,"John Cusack, Samuel L. Jackson, Mary McCormack, Paul Birchard",6.8,71.98,10515,24.92592592592593,7361706.0,0.0
805,805,The Gambler,Rupert Wyatt,"Mark Wahlberg, Jessica Lange, John Goodman, Brie Larson",6.0,33.63,96252,13.390328151986186,3825839.0,5.0
806,806,Prince of Persia: The Sands of Time,Mike Newell,"Jake Gyllenhaal, Gemma Arterton, Ben Kingsley,Alfred Molina",6.6,90.76,5069861,17.497354497354493,74793.0,130.0
807,807,The Spectacular Now,James Ponsoldt,"Miles Teller, Shailene Woodley, Kyle Chandler,Jennifer Jason Leigh",7.1,6.85,398533,64.2453567937439,1260409.0,9837.0
808,808,A United Kingdom,Amma Asante,"David Oyelowo, Rosamund Pike, Tom Felton, Jack Davenport",6.8,3.9,23182,6.186004784688995,2861249.0,23908.0
810,810,Turbo Kid,François Simard,"Munro Chambers, Laurence Leboeuf, Michael Ironside, Edwin Wright",6.7,0.05,22276,33.22026431718061,797.0,334.0
811,811,Mama,Andrés Muschietti,"Jessica Chastain, Nikolaj Coster-Waldau, Megan Charpentier, Isabelle Nélisse",6.2,71.59,3211983,10.672643869891576,712204.0,0.0
812,812,Orphan,Jaume Collet-Serra,"Vera Farmiga, Peter Sarsgaard, Isabelle Fuhrman, CCH Pounder",7.0,41.57,3699537,19.923076923076927,213779.0,0.0
813,813,To Rome with Love,Woody Allen,"Woody Allen, Penélope Cruz, Jesse Eisenberg, Ellen Page",6.3,16.68,62625,20.985915492957748,1994.0,1994.0
814,814,Fantastic Mr. Fox,Wes Anderson,"George Clooney, Meryl Streep, Bill Murray, Jason Schwartzman",7.8,21.0,308648,17.489905787348587,39709.0,4559.0
815,815,Inside Man,Spike Lee,"Denzel Washington, Clive Owen, Jodie Foster,Christopher Plummer",7.6,88.5,1143,26.66666666666667,1756.0,801691.0
817,817,127 Hours,Danny Boyle,"James Franco, Amber Tamblyn, Kate Mara, Sean Bott",7.6,18.33,1465084,43.91139240506329,250012.0,275.0
818,818,Annabelle,John R. Leonetti,"Ward Horton, Annabelle Wallis, Alfre Woodard,Tony Amendola",5.4,84.26,4416828,7.456158061724834,53389.0,0.0
821,821,The Imaginarium of Doctor Parnassus,Terry Gilliam,"Christopher Plummer, Lily Cole, Heath Ledger,Andrew Garfield",6.8,7.69,2005,39.46153846153846,30140.0,188942.0
822,822,G.I. Joe: The Rise of Cobra,Stephen Sommers,"Dennis Quaid, Channing Tatum, Marlon Wayans,Adewale Akinnuoye-Agbaje",5.8,150.17,6300357,17.341463414634145,8854765.0,606.0
823,823,Christine,Antonio Campos,"Rebecca Hall, Michael C. Hall, Tracy Letts, Maria Dizzia",7.0,0.3,256687,29.9375,1260.0,302.0
826,826,Shut In,Farren Blackburn,"Naomi Watts, Charlie Heaton, Jacob Tremblay,Oliver Platt",4.6,6.88,39581,17.20159151193634,95792.0,1757.0
828,828,Grindhouse,Robert Rodriguez,"Kurt Russell, Rose McGowan, Danny Trejo, Zoë Bell",7.6,25.03,315078,10.035087719298245,914711.0,98216.0
829,829,Disaster Movie,Jason Friedberg,"Carmen Electra, Vanessa Lachey,Nicole Parker, Matt Lanter",1.9,14.17,125688,29.34072022160665,393043.0,148.0
830,830,Rocky Balboa,Sylvester Stallone,"Sylvester Stallone, Antonio Tarver, Milo Ventimiglia, Burt Young",7.2,70.27,11530346,34.0,563208.0,2817.0
831,831,Diary of a Wimpy Kid: Dog Days,David Bowers,"Zachary Gordon, Robert Capron, Devon Bostick,Steve Zahn",6.4,49.0,2587922,21.385365853658534,101885.0,572.0
832,832,Jane Eyre,Cary Joji Fukunaga,"Mia Wasikowska, Michael Fassbender, Jamie Bell, Su Elliot",7.4,11.23,329110,41.04545454545455,155996.0,0.0
833,833,Fool's Gold,Andy Tennant,"Matthew McConaughey, Kate Hudson, Donald Sutherland, Alexis Dziena",5.7,70.22,115119,17.65625,2452786.0,674.0
834,834,The Dictator,Larry Charles,"Sacha Baron Cohen, Anna Faris, John C. Reilly, Ben Kingsley",6.4,59.62,49201,15.095393662201896,189.0,91.0
835,835,The Loft,Erik Van Looy,"Karl Urban, James Marsden, Wentworth Miller, Eric Stonestreet",6.3,5.98,34222,16.970954356846473,97354.0,12.0
836,836,Bacalaureat,Cristian Mungiu,"Adrian Titieni, Maria-Victoria Dragus, Lia Bugnar,Malina Manovici",7.5,0.13,8167,9.894736842105264,0.0,5156.0
837,837,You Don't Mess with the Zohan,Dennis Dugan,"Adam Sandler, John Turturro, Emmanuelle Chriqui,Nick Swardson",5.5,100.02,1208491,10.4875,2160912.0,0.0
840,840,Horrible Bosses 2,Sean Anders,"Jason Bateman, Jason Sudeikis, Charlie Day, Jennifer Aniston",6.3,54.41,664537,16.894472361809044,1813090.0,164.0
841,841,A Bigger Splash,Luca Guadagnino,"Tilda Swinton, Matthias Schoenaerts, Ralph Fiennes, Dakota Johnson",6.4,1.98,11548,11.075980392156863,1485.0,39.0
842,842,Melancholia,Lars von Trier,"Kirsten Dunst, Charlotte Gainsbourg, Kiefer Sutherland, Alexander Skarsgård",7.1,3.03,267767,9.872813990461047,493339.0,1868.0
843,843,The Princess and the Frog,Ron Clements,"Anika Noni Rose, Keith David, Oprah Winfrey, Bruno Campos",7.1,104.37,3979005,3.3404825737265416,932506.0,35.0
844,844,Unstoppable,Tony Scott,"Denzel Washington, Chris Pine, Rosario Dawson, Ethan Suplee",6.8,81.56,411564,16.765690376569037,660453.0,983.0
845,845,Flight,Robert Zemeckis,"Denzel Washington, Nadine Velazquez, Don Cheadle, John Goodman",7.3,93.75,321337,24.24719101123595,590453.0,16.0
846,846,Home,Tim Johnson,"Jim Parsons, Rihanna, Steve Martin, Jennifer Lopez",6.7,177.34,838984,12.569026548672564,86646480.0,4761.0
847,847,La migliore offerta,Giuseppe Tornatore,"Geoffrey Rush, Jim Sturgess, Sylvia Hoeks,Donald Sutherland",7.8,0.09,76359,16.55,4037.0,0.0
849,849,42,Brian Helgeland,"Chadwick Boseman, T.R. Knight, Harrison Ford,Nicole Beharie",7.5,95.0,466982,34.363934426229505,559933.0,0.0
850,850,21,Robert Luketic,"Jim Sturgess, Kate Bosworth, Kevin Spacey, Aaron Yoo",6.8,81.16,15646,14.661016949152538,4899350.0,45.0
851,851,Begin Again,John Carney,"Keira Knightley, Mark Ruffalo, Adam Levine, Hailee Steinfeld",7.4,16.17,378682,38.401368301026224,8840374.0,495.0
852,852,Out of the Furnace,Scott Cooper,"Christian Bale, Casey Affleck, Zoe Saldana, Woody Harrelson",6.8,11.33,100198,24.541561712846352,763569.0,382.0
853,853,Vicky Cristina Barcelona,Woody Allen,"Rebecca Hall, Scarlett Johansson, Javier Bardem,Christopher Evan Welch",7.1,23.21,594220,14.83838383838384,9805.0,1994.0
854,854,Kung Fu Panda,Mark Osborne,"Jack Black, Ian McShane,Angelina Jolie, Dustin Hoffman",7.6,215.4,22285368,9.547619047619047,59031.0,89.0
855,855,Barbershop: The Next Cut,Malcolm D. Lee,"Ice Cube, Regina Hall, Anthony Anderson, Eve",5.9,54.01,621897,15.964601769911507,4662593.0,26466.0
856,856,Terminator Salvation,McG,"Christian Bale, Sam Worthington, Anton Yelchin, Moon Bloodgood",6.6,125.32,1319928,20.703296703296704,3716.0,96224.0
857,857,Freedom Writers,Richard LaGravenese,"Hilary Swank, Imelda Staunton, Patrick Dempsey, Scott Glenn",7.5,36.58,22821,0.0,1451666.0,0.0
858,858,The Hills Have Eyes,Alexandre Aja,"Ted Levine, Kathleen Quinlan, Dan Byrd, Emilie de Ravin",6.4,41.78,727549,13.750769230769231,305.0,24407.0
859,859,Changeling,Clint Eastwood,"Angelina Jolie, Colm Feore, Amy Ryan, Gattlin Griffith",7.8,35.71,2320,26.45454545454545,59031.0,549.0
860,860,Remember Me,Allen Coulter,"Robert Pattinson, Emilie de Ravin, Caitlyn Rund,Moisés Acevedo",7.2,19.06,2417,19.68478260869565,393781.0,0.0
862,862,"Alexander and the Terrible, Horrible, No Good, Very Bad Day",Miguel Arteta,"Steve Carell, Jennifer Garner, Ed Oxenbould, Dylan Minnette",6.2,66.95,111968,13.069835111542194,5362392.0,0.0
863,863,Locke,Steven Knight,"Tom Hardy, Olivia Colman, Ruth Wilson, Andrew Scott",7.1,1.36,62991,13.304761904761904,8953.0,363.0
865,865,Horns,Alexandre Aja,"Daniel Radcliffe, Juno Temple, Max Minghella, Joe Anderson",6.5,0.16,122154,20.448526270824434,35711.0,24407.0
866,866,Indignation,James Schamus,"Logan Lerman, Sarah Gadon, Tijuana Ricks, Sue Dahlman",6.9,3.4,12630,41.46341463414634,1496009.0,2842.0
867,867,The Stanford Prison Experiment,Kyle Patrick Alvarez,"Ezra Miller, Tye Sheridan, Billy Crudup, Olivia Thirlby",6.9,0.64,26885,33.606648199445985,6548.0,0.0
868,868,Diary of a Wimpy Kid: Rodrick Rules,David Bowers,"Zachary Gordon, Devon Bostick, Robert Capron,Rachael Harris",6.6,52.69,2587922,16.380701754385964,101885.0,572.0
869,869,Mission: Impossible III,J.J. Abrams,"Tom Cruise, Michelle Monaghan, Ving Rhames, Philip Seymour Hoffman",6.9,133.38,3365243,20.634146341463413,6732569.0,1.0
870,870,En man som heter Ove,Hannes Holm,"Rolf Lassgård, Bahar Pars, Filip Berg, Ida Engvoll",7.7,3.36,5905,46.25,145.0,0.0
871,871,Dragonball Evolution,James Wong,"Justin Chatwin, James Marsters, Yun-Fat Chow, Emmy Rossum",2.7,9.35,0,0.1756291390728477,15235.0,410.0
872,872,Red Dawn,Dan Bradley,"Chris Hemsworth, Isabel Lucas, Josh Hutcherson, Josh Peck",5.4,44.8,356717,5.83831628638867,3037307.0,357.0
873,873,One Day,Lone Scherfig,"Anne Hathaway, Jim Sturgess, Patricia Clarkson,Tom Mison",7.0,13.77,1456984,48.20857699805068,747.0,0.0
874,874,Life as We Know It,Greg Berlanti,"Katherine Heigl, Josh Duhamel, Josh Lucas, Alexis Clagett",6.6,53.36,907096,33.1921568627451,1322156.0,6.0
875,875,28 Weeks Later,Juan Carlos Fresnadillo,"Jeremy Renner, Rose Byrne, Robert Carlyle, Harold Perrineau",7.0,28.64,897969,2.6973684210526314,3506614.0,0.0
876,876,Warm Bodies,Jonathan Levine,"Nicholas Hoult, Teresa Palmer, John Malkovich,Analeigh Tipton",6.9,66.36,2358774,31.813327247832042,491134.0,108.0
877,877,Blue Jasmine,Woody Allen,"Cate Blanchett, Alec Baldwin, Peter Sarsgaard, Sally Hawkins",7.3,33.4,62769,8.403846153846152,257897.0,1994.0
878,878,G.I. Joe: Retaliation,Jon M. Chu,"Dwayne Johnson, Channing Tatum, Adrianne Palicki,Byung-hun Lee",5.8,122.51,6300357,20.391332470892625,12692920.0,600201.0
879,879,Wrath of the Titans,Jonathan Liebesman,"Sam Worthington, Liam Neeson, Rosamund Pike, Ralph Fiennes",5.8,83.64,2668505,18.489991993594877,6866.0,0.0
880,880,Shin Gojira,Hideaki Anno,"Hiroki Hasegawa, Yutaka Takenouchi,Satomi Ishihara, Ren Ôsugi",6.9,1.91,7100,11.168591224018476,68.0,0.0
881,881,Saving Mr. Banks,John Lee Hancock,"Emma Thompson, Tom Hanks, Annie Rose Buckley, Colin Farrell",7.5,83.3,358203,22.297619047619047,15323742.0,117.0
882,882,Transcendence,Wally Pfister,"Johnny Depp, Rebecca Hall, Morgan Freeman, Cillian Murphy",6.3,23.01,447023,24.713595166163138,6890.0,0.0
883,883,Rio,Carlos Saldanha,"Jesse Eisenberg, Anne Hathaway, George Lopez,Karen Disher",6.9,143.62,12272474,5.406749555950266,2107627.0,3.0
884,884,Equals,Drake Doremus,"Nicholas Hoult, Kristen Stewart, Vernetta Lopez,Scott Lawrence",6.1,0.03,44485,18.66421439831845,491134.0,8312.0
885,885,Babel,Alejandro González Iñárritu,"Brad Pitt, Cate Blanchett, Gael García Bernal, Mohamed Akhzam",7.5,34.3,39966,0.0,2468086.0,0.0
886,886,The Tree of Life,Terrence Malick,"Brad Pitt, Sean Penn, Jessica Chastain, Hunter McCracken",6.8,13.3,1098,36.45679012345679,712204.0,3.0
887,887,The Lucky One,Scott Hicks,"Zac Efron, Taylor Schilling, Blythe Danner, Riley Thomas Stewart",6.5,60.44,2659022,26.810725552050474,16039899.0,1176.0
888,888,Piranha 3D,Alexandre Aja,"Elisabeth Shue, Jerry O'Connell, Richard Dreyfuss,Ving Rhames",5.5,25.0,441223,11.507936507936508,124822.0,24407.0
889,889,50/50,Jonathan Levine,"Joseph Gordon-Levitt, Seth Rogen, Anna Kendrick, Bryce Dallas Howard",7.7,34.96,559450,15.5,7491280.0,108.0
891,891,This Is 40,Judd Apatow,"Paul Rudd, Leslie Mann, Maude Apatow, Iris Apatow",6.2,67.52,0,8.10820895522388,196843.0,2330400.0
892,892,Real Steel,Shawn Levy,"Hugh Jackman, Evangeline Lilly, Dakota Goyo,Anthony Mackie",7.1,85.46,3419647,11.311688311688313,12465933.0,10765.0
893,893,Sex and the City,Michael Patrick King,"Sarah Jessica Parker, Kim Cattrall, Cynthia Nixon, Kristin Davis",5.5,152.64,13769753,5.622302158273381,257719.0,0.0
894,894,Rambo,Sylvester Stallone,"Sylvester Stallone, Julie Benz, Matthew Marsden, Graham McTavish",7.1,42.72,19768701,17.75531914893617,291421.0,2817.0
896,896,Concussion,Peter Landesman,"Will Smith, Alec Baldwin, Albert Brooks, David Morse",7.1,34.53,310235,11.7289769683985,1771144.0,321.0
897,897,The Fall,Tarsem Singh,"Lee Pace, Catinca Untaru, Justine Waddell, Kim Uylenbroek",7.9,2.28,6165,44.56616415410385,263437.0,84.0
898,898,The Ugly Truth,Robert Luketic,"Katherine Heigl, Gerard Butler, Bree Turner, Eric Winter",6.5,88.92,253,24.642553191489363,1322156.0,45.0
899,899,Bride Wars,Gary Winick,"Kate Hudson, Anne Hathaway, Candice Bergen, Bryan Greenberg",5.5,58.72,1733436,25.45,1687.0,0.0
900,900,Sleeping with Other People,Leslye Headland,"Jason Sudeikis, Alison Brie, Jordan Carlos,Margarita Levieva",6.5,0.81,11357,14.506048387096774,894764.0,5159.0
901,901,Snakes on a Plane,David R. Ellis,"Samuel L. Jackson, Julianna Margulies, Nathan Phillips, Rachel Blanchard",5.6,34.01,35235,7.028985507246378,7361708.0,29.0
902,902,What If,Michael Dowse,"Daniel Radcliffe, Zoe Kazan, Megan Park, Adam Driver",6.8,3.45,389280,57.08580508474577,35711.0,382.0
903,903,How to Train Your Dragon 2,Dean DeBlois,"Jay Baruchel, Cate Blanchett, Gerard Butler, Craig Ferguson",7.9,177.0,9553628,53.81589958158995,502727.0,10667.0
904,904,RoboCop,José Padilha,"Joel Kinnaman, Gary Oldman, Michael Keaton, Abbie Cornish",6.2,58.61,1514807,10.120222929936306,459279.0,1263.0
906,906,"Hello, My Name Is Doris",Michael Showalter,"Sally Field, Max Greenfield, Tyne Daly, Wendi McLendon-Covey",6.7,14.44,30759,29.524675324675325,103.0,0.0
907,907,Ocean's Thirteen,Steven Soderbergh,"George Clooney, Brad Pitt, Matt Damon,Michael Mantell",6.9,117.14,0,18.235294117647054,1389.0,0.0
908,908,Slither,James Gunn,"Nathan Fillion, Elizabeth Banks, Michael Rooker, Don Thompson",6.5,7.77,1937,7.854330708661418,3633873.0,414289.0
909,909,Contagion,Steven Soderbergh,"Matt Damon, Kate Winslet, Jude Law, Gwyneth Paltrow",6.6,75.64,136581,10.51294343240652,767.0,0.0
910,910,Il racconto dei racconti - Tale of Tales,Matteo Garrone,"Salma Hayek, Vincent Cassel, Toby Jones, John C. Reilly",6.4,0.08,729,9.830125120307988,256124.0,75.0
912,912,Bridge to Terabithia,Gabor Csupo,"Josh Hutcherson, AnnaSophia Robb, Zooey Deschanel, Robert Patrick",7.2,82.23,226355,32.873873873873876,6687296.0,0.0
913,913,Coherence,James Ward Byrkit,"Emily Baldoni, Maury Sterling, Nicholas Brendon, Elizabeth Gracen",7.2,0.07,12262,18.88636363636364,123983.0,1096.0
914,914,Notorious,George Tillman Jr.,"Jamal Woolard, Anthony Mackie, Derek Luke,Momo Dione",6.7,36.84,136754,33.59683794466403,542002.0,6.0
915,915,Goksung,Hong-jin Na,"Jun Kunimura, Jung-min Hwang, Do-won Kwak, Woo-hee Chun",7.5,0.79,489057,19.703910614525142,0.0,6.0
916,916,The Expendables 2,Simon West,"Sylvester Stallone, Liam Hemsworth, Randy Couture,Jean-Claude Van Damme",6.6,85.02,11133855,27.76923076923077,1728629.0,601.0
918,918,Perfume: The Story of a Murderer,Tom Tykwer,"Ben Whishaw, Dustin Hoffman, Alan Rickman,Francesc Albiol",7.5,2.21,27688,0.0,1370.0,108.0
919,919,The Golden Compass,Chris Weitz,"Nicole Kidman, Daniel Craig, Dakota Blue Richards, Ben Walker",6.1,70.08,0,15.679012345679011,73246.0,52803.0
920,920,Centurion,Neil Marshall,"Michael Fassbender, Dominic West, Olga Kurylenko,Andreas Wisniewski",6.4,0.12,94551,10.696062992125984,18977.0,292.0
921,921,Scouts Guide to the Zombie Apocalypse,Christopher Landon,"Tye Sheridan, Logan Miller, Joey Morgan,Sarah Dumont",6.3,3.64,394473,17.468013468013467,6548.0,0.0
922,922,17 Again,Burr Steers,"Zac Efron, Matthew Perry, Leslie Mann, Thomas Lennon",6.4,64.15,5448856,49.141129032258064,16039901.0,0.0
923,923,No Escape,John Erick Dowdle,"Lake Bell, Pierce Brosnan, Owen Wilson,Chatchawai Kamonsakpitak",6.8,27.29,90646,13.943624161073826,132873.0,3.0
924,924,Superman Returns,Bryan Singer,"Brandon Routh, Kevin Spacey, Kate Bosworth, James Marsden",6.1,200.07,1194821,12.176258992805755,4899350.0,55.0
925,925,The Twilight Saga: Breaking Dawn - Part 1,Bill Condon,"Kristen Stewart, Robert Pattinson, Taylor Lautner, Gil Birmingham",4.9,281.28,14238027,16.836906584992338,189335.0,112.0
926,926,Precious,Lee Daniels,"Gabourey Sidibe, Mo'Nique, Paula Patton, Mariah Carey",7.3,47.54,669250,47.39106145251397,185825.0,30.0
927,927,The Sea of Trees,Gus Van Sant,"Matthew McConaughey, Naomi Watts, Ken Watanabe,Ryoko Seta",5.9,0.02,30110,12.67588932806324,2452786.0,905.0
929,929,The Master,Paul Thomas Anderson,"Philip Seymour Hoffman, Joaquin Phoenix,Amy Adams, Jesse Plemons",7.1,16.38,159,17.53810623556582,8797.0,0.0
930,930,Footloose,Craig Brewer,"Kenny Wormald, Julianne Hough, Dennis Quaid,Andie MacDowell",5.9,51.78,1399796,3.695139216611609,1297909.0,25.0
931,931,If I Stay,R.J. Cutler,"Chloë Grace Moretz, Mireille Enos, Jamie Blackley,Joshua Leonard",6.8,50.46,3106879,49.85129819040126,3276505.0,2767.0
934,934,The Love Witch,Anna Biller,"Samantha Robinson, Jeffrey Vincent Parise, Laura Waddell, Gian Keys",6.2,0.22,3189,10.285714285714286,37165.0,77.0
935,935,Talladega Nights: The Ballad of Ricky Bobby,Adam McKay,"Will Ferrell, John C. Reilly, Sacha Baron Cohen, Gary Cole",6.6,148.21,700336,0.0,14271.0,3.0
936,936,The Human Centipede (First Sequence),Tom Six,"Dieter Laser, Ashley C. Williams, Ashlynn Yennie, Akihiro Kitamura",4.4,0.18,2438,2.7026022304832718,4470.0,221.0
937,937,Super,James Gunn,"Rainn Wilson, Ellen Page, Liv Tyler, Kevin Bacon",6.8,0.32,3134,18.431034482758623,4542411.0,414289.0
939,939,Up in the Air,Jason Reitman,"George Clooney, Vera Farmiga, Anna Kendrick,Jason Bateman",7.4,83.81,287349,26.096774193548388,7099792.0,155819.0
940,940,The Midnight Meat Train,Ryûhei Kitamura,"Vinnie Jones, Bradley Cooper, Leslie Bibb, Brooke Shields",6.1,0.07,226249,12.395348837209307,41008.0,2.0
941,941,The Twilight Saga: Eclipse,David Slade,"Kristen Stewart, Robert Pattinson, Taylor Lautner,Xavier Samuel",4.9,300.52,44924493,7.840709903593338,189335.0,1293.0
943,943,What's Your Number?,Mark Mylod,"Anna Faris, Chris Evans, Ari Graynor, Blythe Danner",6.1,13.99,81042,31.48453608247423,8659310.0,32.0
944,944,Riddick,David Twohy,"Vin Diesel, Karl Urban, Katee Sackhoff, Jordi Mollà",6.4,42.0,1509639,19.19148936170213,231475.0,21.0
946,946,The Butler,Lee Daniels,"Forest Whitaker, Oprah Winfrey, John Cusack, Jane Fonda",7.2,116.63,7313,9.57643312101911,1700333.0,30.0
947,947,King Cobra,Justin Kelly,"Garrett Clayton, Christian Slater, Molly Ringwald,James Kelley",5.6,0.03,20836,3.5541059094397545,211834.0,290.0
948,948,After Earth,M. Night Shyamalan,"Jaden Smith, David Denman, Will Smith,Sophie Okonedo",4.9,60.52,1629724,11.981737849779089,7558067.0,137508.0
949,949,Kicks,Justin Tipping,"Jahking Guillory, Christopher Jordan Wallace,Christopher Meyer, Kofi Siriboe",6.1,0.15,23796,18.885644768856448,5291.0,1111.0
950,950,Me and Earl and the Dying Girl,Alfonso Gomez-Rejon,"Thomas Mann, RJ Cyler, Olivia Cooke, Nick Offerman",7.8,6.74,122911,60.09883720930232,467.0,0.0
951,951,The Descendants,Alexander Payne,"George Clooney, Shailene Woodley, Amara Miller, Nick Krause",7.3,82.62,21767,4.397035706265439,1260415.0,85.0
952,952,Sex and the City 2,Michael Patrick King,"Sarah Jessica Parker, Kim Cattrall, Kristin Davis, Cynthia Nixon",4.3,95.33,3321433,8.965909090909092,273771.0,0.0
953,953,The Kings of Summer,Jordan Vogt-Roberts,"Nick Robinson, Gabriel Basso, Moises Arias,Nick Offerman",7.2,1.29,100885,56.23809523809525,588.0,0.0
954,954,Death Race,Paul W.S. Anderson,"Jason Statham, Joan Allen, Tyrese Gibson, Ian McShane",6.4,36.06,14961,21.818181818181817,4024.0,251.0
955,955,That Awkward Moment,Tom Gormican,"Zac Efron, Michael B. Jordan, Miles Teller, Imogen Poots",6.2,26.05,1205792,25.95454545454545,16039950.0,2382.0
956,956,Legion,Scott Stewart,"Paul Bettany, Dennis Quaid, Charles S. Dutton, Lucas Black",5.2,40.17,566959,6.709183673469387,237289.0,31.0
957,957,End of Watch,David Ayer,"Jake Gyllenhaal, Michael Peña, Anna Kendrick, America Ferrera",7.7,40.98,3415,32.45945945945946,7099816.0,381.0
958,958,3 Days to Kill,McG,"Kevin Costner, Hailee Steinfeld, Connie Nielsen, Amber Heard",6.2,30.69,135026,19.912885662431947,960389.0,96225.0
959,959,Lucky Number Slevin,Paul McGuigan,"Josh Hartnett, Ben Kingsley, Morgan Freeman, Lucy Liu",7.8,22.49,309,16.133333333333333,6890.0,1.0
960,960,Trance,Danny Boyle,"James McAvoy, Rosario Dawson, Vincent Cassel,Danny Sapani",7.0,2.32,25673,33.27906976744186,660454.0,275.0
961,961,Into the Forest,Patricia Rozema,"Ellen Page, Evan Rachel Wood, Max Minghella,Callum Keith Rennie",5.9,0.01,6759,11.280487804878051,1439626.0,1358.0
962,962,The Other Boleyn Girl,Justin Chadwick,"Natalie Portman, Scarlett Johansson, Eric Bana,Jim Sturgess",6.7,26.81,0,24.357142857142854,41176.0,1202.0
963,963,I Spit on Your Grave,Steven R. Monroe,"Sarah Butler, Jeff Branson, Andrew Howard,Daniel Franzese",6.3,0.09,5956,8.4,37578.0,451.0
967,967,The Walk,Robert Zemeckis,"Joseph Gordon-Levitt, Charlotte Le Bon,Guillaume Baillargeon, Émilie Leclerc",7.3,10.14,175225,27.391509433962263,4449.0,16.0
969,969,The Lone Ranger,Gore Verbinski,"Johnny Depp, Armie Hammer, William Fichtner,Tom Wilkinson",6.5,89.29,754406,19.44188596491228,140258.0,69.0
970,970,Texas Chainsaw 3D,John Luessenhop,"Alexandra Daddario, Tania Raymonde, Scott Eastwood, Trey Songz",4.8,34.33,2293459,8.738219895287957,216690.0,20.0
971,971,Disturbia,D.J. Caruso,"Shia LaBeouf, David Morse, Carrie-Anne Moss, Sarah Roemer",6.9,80.05,487199,0.0,255.0,146.0
972,972,Rock of Ages,Adam Shankman,"Julianne Hough, Diego Boneta, Tom Cruise, Alec Baldwin",5.9,38.51,430683,8.127272727272727,6732606.0,292861.0
973,973,Scream 4,Wes Craven,"Neve Campbell, Courteney Cox, David Arquette, Lucy Hale",6.2,38.18,5562808,16.305882352941175,1103521.0,244147.0
974,974,Queen of Katwe,Mira Nair,"Madina Nalwanga, David Oyelowo, Lupita Nyong'o, Martin Kabanza",7.4,8.81,106810,27.96096654275093,1196779.0,6.0
975,975,My Big Fat Greek Wedding 2,Kirk Jones,"Nia Vardalos, John Corbett, Michael Constantine, Lainie Kazan",6.0,59.57,930507,19.57567567567568,291496.0,7111.0
979,979,The Skin I Live In,Pedro Almodóvar,"Antonio Banderas, Elena Anaya, Jan Cornet,Marisa Paredes",7.6,3.19,0,4.092105263157896,679291.0,213.0
980,980,Miracles from Heaven,Patricia Riggen,"Jennifer Garner, Kylie Rogers, Martin Henderson,Brighton Sharbino",7.0,61.69,617166,23.160371106693173,21917.0,0.0
981,981,Annie,Will Gluck,"Quvenzhané Wallis, Cameron Diaz, Jamie Foxx, Rose Byrne",5.3,85.91,455913,7.295143212951433,4841637.0,266.0
982,982,Across the Universe,Julie Taymor,"Evan Rachel Wood, Jim Sturgess, Joe Anderson, Dana Fuchs",7.4,24.34,774551,0.0,381299.0,11.0
983,983,Let's Be Cops,Luke Greenfield,"Jake Johnson, Damon Wayans Jr., Rob Riggle, Nina Dobrev",6.5,82.39,471338,14.001483679525222,1722883.0,2.0
984,984,Max,Boaz Yakin,"Thomas Haden Church, Josh Wiggins, Luke Kleintank,Lauren Graham",6.8,42.65,261017,20.110433190970106,23511.0,42.0
985,985,Your Highness,David Gordon Green,"Danny McBride, Natalie Portman, James Franco, Rasmus Hardiker",5.6,21.56,6162,9.447698744769877,41176.0,814.0
986,986,Final Destination 5,Steven Quale,"Nicholas D'Agosto, Emma Bell, Arlen Escarpeta, Miles Fisher",5.9,42.58,884178,14.298507462686567,81060.0,0.0
987,987,Endless Love,Shana Feste,"Gabriella Wilde, Alex Pettyfer, Bruce Greenwood,Robert Patrick",6.3,23.39,631522,22.30366492146597,28683.0,0.0
989,989,Selma,Ava DuVernay,"David Oyelowo, Carmen Ejogo, Tim Roth, Lorraine Toussaint",7.5,52.07,289421,30.477372262773727,16878.0,1876066.0
990,990,Underworld: Rise of the Lycans,Patrick Tatopoulos,"Rhona Mitra, Michael Sheen, Bill Nighy, Steven Mackintosh",6.6,45.8,7851463,20.785714285714285,302899.0,0.0
991,991,Taare Zameen Par,Aamir Khan,"Darsheel Safary, Aamir Khan, Tanay Chheda, Sachet Engineer",8.5,1.2,404,6.552941176470588,23047639.0,23047639.0
992,992,Take Me Home Tonight,Michael Dowse,"Topher Grace, Anna Faris, Dan Fogler, Teresa Palmer",6.3,6.92,59759,26.07142857142857,86249.0,382.0
993,993,Resident Evil: Afterlife,Paul W.S. Anderson,"Milla Jovovich, Ali Larter, Wentworth Miller,Kim Coates",5.9,60.13,10492040,10.972972972972975,1511134.0,251.0
994,994,Project X,Nima Nourizadeh,"Thomas Mann, Oliver Cooper, Jonathan Daniel Brown, Dax Flame",6.7,54.72,3436,19.759643916913948,12759.0,16996.0
996,996,Hostel: Part II,Eli Roth,"Lauren German, Heather Matarazzo, Bijou Phillips, Roger Bart",5.5,17.54,219586,8.158730158730158,188160.0,293271.0
