,Title,Director,Actors,Rating,Revenue (Millions),fb_likes,yt_likes_ratio,Top actor followers,Director Followers
176,Fury,David Ayer,"Brad Pitt, Shia LaBeouf, Logan Lerman, Michael Peña",7.6,85.71,947830,22.732394366197184,1496140.0,383.0
177,Inside Out,Pete Docter,"Amy Poehler, Bill Hader, Lewis Black, Mindy Kaling",8.2,356.45,942586,21.37745098039216,12687179.0,1952.0
178,Rock Dog,Ash Brannon,"Luke Wilson, Eddie Izzard, J.K. Simmons, Lewis Black",5.8,9.4,14485,6.734672304439746,4766977.0,1.0
179,Terminator Genisys,Alan Taylor,"Arnold Schwarzenegger, Jason Clarke, Emilia Clarke,Jai Courtney",6.5,89.73,1486395,8.583924123395287,4422476.0,302.0
180,Percy Jackson & the Olympians: The Lightning Thief,Chris Columbus,"Logan Lerman, Kevin McKidd, Steve Coogan,Brandon T. Jackson",5.9,88.76,1957719,14.133016627078385,1496140.0,145.0
181,Les Misérables,Tom Hooper,"Hugh Jackman, Russell Crowe, Anne Hathaway,Amanda Seyfried",7.6,148.78,23845,25.997435897435896,12455676.0,232.0
182,Children of Men,Alfonso Cuarón,"Julianne Moore, Clive Owen, Chiwetel Ejiofor,Michael Caine",7.9,35.29,299964,24.58712121212121,875847.0,52776.0
183,20th Century Women,Mike Mills,"Annette Bening, Elle Fanning, Greta Gerwig, Billy Crudup",7.4,5.66,42225,36.918269230769226,9996.0,451.0
184,Spy,Paul Feig,"Melissa McCarthy, Rose Byrne, Jude Law, Jason Statham",7.1,110.82,335460,24.740259740259734,967362.0,2325847.0
185,The Intouchables,Olivier Nakache,"François Cluzet, Omar Sy, Anne Le Ny, Audrey Fleurot",8.6,13.18,735750,49.64985163204747,3024938.0,41.0
186,Straight Outta Compton,F. Gary Gray,"O'Shea Jackson Jr., Corey Hawkins, Jason Mitchell,Neil Brown Jr.",7.9,161.03,2965202,33.315487571701716,104239.0,1.0
187,The Amazing Spider-Man 2,Marc Webb,"Andrew Garfield, Emma Stone, Jamie Foxx, Paul Giamatti",6.7,202.85,20603632,38.950980392156865,4841603.0,740.0
188,The Conjuring,James Wan,"Patrick Wilson, Vera Farmiga, Ron Livingston, Lili Taylor",7.5,137.39,4644571,13.1207065750736,213767.0,79.0
189,The Hangover,Todd Phillips,"Zach Galifianakis, Bradley Cooper, Justin Bartha, Ed Helms",7.8,277.31,20013772,24.4,3861205.0,378.0
190,Battleship,Peter Berg,"Alexander Skarsgård, Brooklyn Decker, Liam Neeson,Rihanna",5.8,65.17,2231455,11.576994434137287,743071.0,516.0
191,Rise of the Planet of the Apes,Rupert Wyatt,"James Franco, Andy Serkis, Freida Pinto, Karin Konoval",7.6,176.74,4376738,17.293103448275858,196664.0,5.0
192,Norman: The Moderate Rise and Tragic Fall of a New York Fixer,Joseph Cedar,"Richard Gere, Lior Ashkenazi, Michael Sheen,Charlotte Gainsbourg",7.1,2.27,304,7.8,302426.0,9.0
193,Black Swan,Darren Aronofsky,"Natalie Portman, Mila Kunis, Vincent Cassel,Winona Ryder",8.0,106.95,3492181,20.315555555555555,41154.0,263352.0
194,Nymphomaniac: Vol. I,Lars von Trier,"Charlotte Gainsbourg, Stellan Skarsgård, Stacy Martin, Shia LaBeouf",7.0,0.79,225296,5.080310880829017,21466.0,1869.0
195,Teenage Mutant Ninja Turtles: Out of the Shadows,Dave Green,"Megan Fox, Will Arnett, Tyler Perry, Laura Linney",6.0,0.54,2707274,14.36088295687885,5514945.0,966.0
196,Knock Knock,Eli Roth,"Keanu Reeves, Lorenza Izzo, Ana de Armas, Aaron Burns",4.9,0.03,58570,4.631908831908833,34383.0,293282.0
197,Dirty Grandpa,Dan Mazer,"Robert De Niro, Zac Efron, Zoey Deutch, Aubrey Plaza",6.0,35.54,236657,13.719895287958114,16036514.0,3.0
198,Cloud Atlas,Tom Tykwer,"Tom Hanks, Halle Berry, Hugh Grant, Hugo Weaving",7.5,27.1,233,27.235110803324105,15321132.0,108.0
199,X-Men Origins: Wolverine,Gavin Hood,"Hugh Jackman, Liev Schreiber, Ryan Reynolds, Danny Huston",6.7,179.88,14328359,25.393939393939394,12455627.0,117.0
200,Skyfall,Sam Mendes,"Daniel Craig, Javier Bardem, Naomie Harris, Judi Dench",7.8,304.36,242142,23.230334637114296,40641.0,159.0
201,The Hobbit: An Unexpected Journey,Peter Jackson,"Martin Freeman, Ian McKellen, Richard Armitage,Andy Serkis",7.9,303.0,7343723,36.017353579175705,3902876.0,50874.0
202,21 Jump Street,Phil Lord,"Jonah Hill, Channing Tatum, Ice Cube,Brie Larson",7.2,138.45,3745843,14.561688311688313,8854752.0,373.0
203,Sing Street,John Carney,"Ferdia Walsh-Peelo, Aidan Gillen, Maria Doyle Kennedy, Jack Reynor",8.0,3.23,94060,67.69364161849711,54.0,494.0
204,Oblivion,Joseph Kosinski,"Tom Cruise, Morgan Freeman, Andrea Riseborough, Olga Kurylenko",7.0,89.02,384131,19.191666666666666,6730699.0,210.0
205,22 Jump Street,Phil Lord,"Channing Tatum, Jonah Hill, Ice Cube,Nick Offerman",7.1,191.62,3745843,48.17587939698493,8854752.0,373.0
206,Iron Man Three,Shane Black,"Robert Downey Jr., Guy Pearce, Gwyneth Paltrow,Don Cheadle",7.2,408.99,19162040,20.592788971367973,10367490.0,368.0
207,Sherlock Holmes,Guy Ritchie,"Robert Downey Jr., Jude Law, Rachel McAdams, Mark Strong",7.6,209.02,9622284,32.29577464788732,10367490.0,17.0
208,The Danish Girl,Tom Hooper,"Eddie Redmayne, Alicia Vikander, Amber Heard, Ben Whishaw",7.0,12.71,706975,9.439583027455587,73469.0,232.0
209,Hercules,Brett Ratner,"Dwayne Johnson, John Hurt, Ian McShane, Joseph Fiennes",6.0,72.66,969511,13.122940430925224,12689385.0,253645.0
210,Sucker Punch,Zack Snyder,"Emily Browning, Vanessa Hudgens, Abbie Cornish,Jena Malone",6.1,36.38,1590167,17.173387096774196,7471259.0,626671.0
211,Keeping Up with the Joneses,Greg Mottola,"Zach Galifianakis, Isla Fisher, Jon Hamm, Gal Gadot",5.8,14.9,43839,28.751412429378533,3861205.0,35144.0
212,Masterminds,Jared Hess,"Zach Galifianakis, Kristen Wiig, Owen Wilson, Ross Kimball",5.8,17.36,130267,12.782934131736527,3861205.0,716.0
213,Pitch Perfect,Jason Moore,"Anna Kendrick, Brittany Snow, Rebel Wilson, Anna Camp",7.2,65.0,6081417,35.369369369369366,7099391.0,770.0
214,Neighbors 2: Sorority Rising,Nicholas Stoller,"Seth Rogen, Rose Byrne, Zac Efron, Chloë Grace Moretz",5.7,55.29,1987,32.660570592538406,16036515.0,24512.0
215,Man of Steel,Zack Snyder,"Henry Cavill, Amy Adams, Michael Shannon, Diane Lane",7.1,291.02,3874829,23.82283161300262,53257.0,626671.0
216,The Choice,Ross Katz,"Benjamin Walker, Teresa Palmer, Alexandra Daddario,Maggie Grace",6.6,18.71,258138,20.152428810720266,157837.0,7.0
217,The Devil Wears Prada,David Frankel,"Anne Hathaway, Meryl Streep, Adrian Grenier, Emily Blunt",6.8,124.73,2221716,35.516129032258064,368161.0,16.0
218,The Infiltrator,Brad Furman,"Bryan Cranston, John Leguizamo, Diane Kruger, Amy Ryan",7.1,15.43,185688,30.69526627218935,2169683.0,880.0
219,The Equalizer,Antoine Fuqua,"Denzel Washington, Marton Csokas, Chloë Grace Moretz, David Harbour",7.2,101.53,515988,25.47272727272728,3276830.0,14.0
220,Lone Survivor,Peter Berg,"Mark Wahlberg, Taylor Kitsch, Emile Hirsch, Ben Foster",7.5,125.07,265796,11.944894651539707,3825714.0,516.0
221,The Cabin in the Woods,Drew Goddard,"Kristen Connolly, Chris Hemsworth, Anna Hutchison,Fran Kranz",7.0,42.04,661956,12.621578099838967,3034110.0,284.0
222,The House Bunny,Fred Wolf,"Anna Faris, Colin Hanks, Emma Stone, Kat Dennings",5.5,48.24,76616,34.09756097560975,503795.0,17.0
223,Alice Through the Looking Glass,James Bobin,"Mia Wasikowska, Johnny Depp, Helena Bonham Carter, Anne Hathaway",6.2,77.04,15112217,26.57409274193548,3295.0,1.0
224,The Fast and the Furious: Tokyo Drift,Justin Lin,"Lucas Black, Zachery Ty Bryan, Shad Moss, Damien Marzette",6.0,62.49,60746271,17.84090909090909,1524.0,79693.0
225,How to Be Single,Christian Ditter,"Dakota Johnson, Rebel Wilson, Leslie Mann, Alison Brie",6.1,46.81,355842,24.003205128205128,2958654.0,2807.0
226,The Blind Side,John Lee Hancock,"Quinton Aaron, Sandra Bullock, Tim McGraw,Jae Head",7.7,255.95,8411238,84.80790960451978,3048313.0,117.0
227,The Babadook,Jennifer Kent,"Essie Davis, Noah Wiseman, Daniel Henshall, Hayley McElhinney",6.8,0.92,26444,15.858575197889182,696.0,247.0
228,The Hobbit: The Battle of the Five Armies,Peter Jackson,"Ian McKellen, Martin Freeman, Richard Armitage,Cate Blanchett",7.4,255.11,14200,35.34032376747609,3902877.0,50874.0
229,Harry Potter and the Order of the Phoenix,David Yates,"Daniel Radcliffe, Emma Watson, Rupert Grint, Brendan Gleeson",7.5,292.0,4898,48.050632911392405,28809834.0,145.0
230,Snowpiercer,Bong Joon Ho,"Chris Evans, Jamie Bell, Tilda Swinton, Ed Harris",7.0,4.56,103347,20.76082474226804,8651203.0,1.0
231,The 5th Wave,J Blakeson,"Chloë Grace Moretz, Matthew Zuk, Gabriela Lopez,Bailey Anne Borders",5.2,34.91,706643,17.38340978593272,3276830.0,2404.0
232,The Visit,M. Night Shyamalan,"Olivia DeJonge, Ed Oxenbould, Deanna Dunagan, Peter McRobbie",6.2,65.07,809901,8.5288256227758,4038.0,137483.0
233,Fast Five,Justin Lin,"Vin Diesel, Paul Walker, Dwayne Johnson, Jordana Brewster",7.3,209.81,694,17.621052631578948,12689386.0,79693.0
234,Step Up,Anne Fletcher,"Channing Tatum, Jenna Dewan Tatum, Damaine Radcliff, De'Shawn Washington",6.5,65.27,18590070,16.144144144144143,8854753.0,5.0
235,RocknRolla,Guy Ritchie,"Gerard Butler, Tom Wilkinson, Idris Elba, Thandie Newton",7.3,5.69,280801,9.811764705882354,2490136.0,17.0
236,In Time,Andrew Niccol,"Justin Timberlake, Amanda Seyfried, Cillian Murphy,Olivia Wilde",6.7,37.55,126240,18.79789473684211,65472543.0,24.0
237,The Last Witch Hunter,Breck Eisner,"Vin Diesel, Rose Leslie, Elijah Wood, Ólafur Darri Ólafsson",6.0,27.36,439749,16.888698630136982,908088.0,31.0
238,Victor Frankenstein,Paul McGuigan,"Daniel Radcliffe, James McAvoy, Jessica Brown Findlay, Andrew Scott",6.0,5.77,90622,16.70400878638111,35710.0,1.0
239,Green Room,Jeremy Saulnier,"Anton Yelchin, Imogen Poots, Alia Shawkat,Patrick Stewart",7.0,3.22,68421,9.954545454545457,44187.0,3.0
240,Blackhat,Michael Mann,"Chris Hemsworth, Viola Davis, Wei Tang, Leehom Wang",5.4,7.1,956152,8.750617283950618,3034111.0,1008.0
241,Storks,Nicholas Stoller,"Andy Samberg, Katie Crown,Kelsey Grammer, Jennifer Aniston",6.9,72.66,342153,20.53731343283582,88060.0,24512.0
242,American Sniper,Clint Eastwood,"Bradley Cooper, Sienna Miller, Kyle Gallner, Cole Konis",7.3,350.12,2293342,8.159622195985833,41014.0,549.0
243,Lincoln,Steven Spielberg,"Daniel Day-Lewis, Sally Field, David Strathairn,Joseph Gordon-Levitt",7.4,182.2,421212,15.153508771929824,103.0,533.0
244,Rush,Ron Howard,"Daniel Brühl, Chris Hemsworth, Olivia Wilde,Alexandra Maria Lara",8.1,26.9,645850,24.31707317073171,3034111.0,2439784.0
245,Silver Linings Playbook,David O. Russell,"Bradley Cooper, Jennifer Lawrence, Robert De Niro, Jacki Weaver",7.8,132.09,104616,31.58490566037736,41014.0,549.0
246,The Fault in Our Stars,Josh Boone,"Shailene Woodley, Ansel Elgort, Nat Wolff, Laura Dern",7.8,124.87,11015944,74.26905829596413,3914351.0,453.0
247,Blended,Frank Coraci,"Adam Sandler, Drew Barrymore, Wendi McLendon-Covey, Kevin Nealon",6.5,46.28,467244,11.356390288593678,2160791.0,294.0
248,Fast & Furious,Justin Lin,"Vin Diesel, Paul Walker, Michelle Rodriguez, Jordana Brewster",6.6,155.02,60746270,17.65174129353234,189512.0,79693.0
249,Looper,Rian Johnson,"Joseph Gordon-Levitt, Bruce Willis, Emily Blunt, Paul Dano",7.4,66.47,950825,24.57271095152604,51279.0,853401.0
250,White House Down,Roland Emmerich,"Channing Tatum, Jamie Foxx, Maggie Gyllenhaal,Jason Clarke",6.4,73.1,659608,7.738831615120275,8854753.0,111343.0
251,Pete's Dragon,David Lowery,"Bryce Dallas Howard, Robert Redford, Oakes Fegley,Oona Laurence",6.8,76.2,183428,11.135593220338983,135067.0,71.0
252,The Three Musketeers,Paul W.S. Anderson,"Logan Lerman, Matthew Macfadyen, Ray Stevenson, Milla Jovovich",5.8,20.32,535042,12.0,1496140.0,251.0
253,American Hustle,David O. Russell,"Christian Bale, Amy Adams, Bradley Cooper,Jennifer Lawrence",7.3,150.12,668637,11.587759815242492,41014.0,549.0
254,Midnight in Paris,Woody Allen,"Owen Wilson, Rachel McAdams, Kathy Bates, Kurt Fuller",7.7,56.82,735974,26.43076923076923,1301.0,1994.0
255,Joy,David O. Russell,"Jennifer Lawrence, Robert De Niro, Bradley Cooper, Edgar Ramírez",6.6,56.44,232864,12.620317002881846,41014.0,549.0
256,Café Society,Woody Allen,"Jesse Eisenberg, Kristen Stewart, Steve Carell, Blake Lively",6.7,11.08,44410,14.921052631578947,5356851.0,1994.0
257,The Theory of Everything,James Marsh,"Eddie Redmayne, Felicity Jones, Tom Prior, Sophie Perry",7.7,35.89,765547,70.14698795180722,73469.0,142.0
258,This Is the End,Evan Goldberg,"James Franco, Jonah Hill, Seth Rogen,Jay Baruchel",6.6,101.47,108391,42.77857142857143,7491963.0,20.0
259,About Time,Richard Curtis,"Domhnall Gleeson, Rachel McAdams, Bill Nighy,Lydia Wilson",7.8,15.29,429360,46.18013856812933,1301.0,2522.0
260,Step Brothers,Adam McKay,"Will Ferrell, John C. Reilly, Mary Steenburgen,Richard Jenkins",6.9,100.47,9180207,21.728395061728396,29030.0,3.0
261,Clown,Jon Watts,"Andy Powers, Laura Allen, Peter Stormare, Christian Distefano",5.7,0.05,740,11.428419936373274,461.0,1772.0
262,Star Trek Into Darkness,J.J. Abrams,"Chris Pine, Zachary Quinto, Zoe Saldana, Benedict Cumberbatch",7.8,228.76,3770921,20.511533242876528,1160924.0,1.0
263,Zombieland,Ruben Fleischer,"Jesse Eisenberg, Emma Stone, Woody Harrelson,Abigail Breslin",7.7,75.59,34243,18.528428093645484,32719.0,13909.0
264,"Hail, Caesar!",Ethan Coen,"Josh Brolin, George Clooney, Alden Ehrenreich, Ralph Fiennes",6.3,30.0,202333,11.276683937823837,1389.0,1403.0
265,Slumdog Millionaire,Danny Boyle,"Dev Patel, Freida Pinto, Saurabh Shukla, Anil Kapoor",8.0,141.32,2569902,18.076286764705888,22001.0,275.0
266,The Twilight Saga: Breaking Dawn - Part 2,Bill Condon,"Kristen Stewart, Robert Pattinson, Taylor Lautner, Peter Facinelli",5.5,292.3,14238032,2.5,189343.0,112.0
267,The Amazing Spider-Man,Marc Webb,"Andrew Garfield, Emma Stone, Rhys Ifans, Irrfan Khan",7.0,262.03,20603631,9.749752964426877,32719.0,740.0
268,Sleight,J.D. Dillard,"Jacob Latimore, Seychelle Gabriel, Dulé Hill, Storm Reid",6.0,3.85,136059,21.222493887530558,492418.0,89.0
269,The Maze Runner,Wes Ball,"Dylan O'Brien, Kaya Scodelario, Will Poulter, Thomas Brodie-Sangster",6.8,102.41,4202635,38.918815663801354,4962606.0,102530.0
270,Florence Foster Jenkins,Stephen Frears,"Meryl Streep, Hugh Grant, Simon Helberg, Rebecca Ferguson",6.9,27.37,44234,24.832669322709158,890354.0,68.0
271,Collide,Eran Creevy,"Nicholas Hoult, Felicity Jones, Anthony Hopkins, Ben Kingsley",5.7,2.2,3169,9.487623762376238,491139.0,132.0
272,Black Mass,Scott Cooper,"Johnny Depp, Benedict Cumberbatch, Dakota Johnson, Joel Edgerton",6.9,62.56,3999,38.86847599164928,100563.0,382.0
273,Creed,Ryan Coogler,"Michael B. Jordan, Sylvester Stallone, Tessa Thompson, Phylicia Rashad",7.6,109.71,969443,33.74273858921162,157606.0,476.0
274,Swiss Army Man,Dan Kwan,"Paul Dano, Daniel Radcliffe, Mary Elizabeth Winstead, Antonia Ribero",7.1,4.21,192507,13.588712871287127,35710.0,13.0
275,The Expendables 3,Patrick Hughes,"Sylvester Stallone, Jason Statham, Jet Li, Antonio Banderas",6.1,39.29,8089004,23.37708066581306,14900.0,227.0
276,Southpaw,Antoine Fuqua,"Jake Gyllenhaal, Rachel McAdams, Oona Laurence,Forest Whitaker",7.4,52.42,335243,28.19222071460877,3650.0,14.0
277,Bridge of Spies,Steven Spielberg,"Tom Hanks, Mark Rylance, Alan Alda, Amy Ryan",7.6,72.31,108728,23.38351254480287,15321135.0,533.0
278,The Lego Movie,Phil Lord,"Chris Pratt, Will Ferrell, Elizabeth Banks, Will Arnett",7.8,257.76,1952769,15.228654970760234,5210287.0,373.0
279,Pixels,Chris Columbus,"Adam Sandler, Kevin James, Michelle Monaghan,Peter Dinklage",5.6,78.75,759396,12.288135593220339,2160791.0,145.0
280,Robin Hood,Ridley Scott,"Russell Crowe, Cate Blanchett, Matthew Macfadyen,Max von Sydow",6.7,105.22,75925,13.08433734939759,2747740.0,45.0
281,The Wolverine,James Mangold,"Hugh Jackman, Will Yun Lee, Tao Okamoto, Rila Fukushima",6.7,132.55,10940479,18.572151898734177,12455643.0,41.0
282,John Carter,Andrew Stanton,"Taylor Kitsch, Lynn Collins, Willem Dafoe,Samantha Morton",6.6,73.06,725864,11.811529933481154,20326.0,58405.0
283,The Gunman,Pierre Morel,"Sean Penn, Idris Elba, Jasmine Trinca, Javier Bardem",5.8,10.64,104034,10.786749482401657,2490137.0,3966.0
284,Steve Jobs,Danny Boyle,"Michael Fassbender, Kate Winslet, Seth Rogen, Jeff Daniels",7.2,17.75,473418,13.391405342624855,7491963.0,275.0
285,Minions,Kyle Balda,"Sandra Bullock, Jon Hamm, Michael Keaton, Pierre Coffin",6.4,336.03,34628753,17.6239775648516,459277.0,63.0
286,Despicable Me,Pierre Coffin,"Steve Carell, Jason Segel, Russell Brand, Julie Andrews",7.7,251.5,18224741,3.1005172026085,5356851.0,18.0
287,The Best of Me,Michael Hoffman,"James Marsden, Michelle Monaghan, Luke Bracey,Liana Liberato",6.7,26.76,1042251,45.51348314606742,18263.0,8797.0
288,Zero Dark Thirty,Kathryn Bigelow,"Jessica Chastain, Joel Edgerton, Chris Pratt, Mark Strong",7.4,95.72,259885,10.16788321167883,5210288.0,5.0
289,The Hunger Games: Mockingjay - Part 2,Francis Lawrence,"Jennifer Lawrence, Josh Hutcherson, Liam Hemsworth, Woody Harrelson",6.6,281.67,21400352,34.669839679358724,2889009.0,14.0
290,Taken,Pierre Morel,"Liam Neeson, Maggie Grace, Famke Janssen, Leland Orser",7.8,145.0,4584691,35.529411764705884,110527.0,3966.0
291,Pitch Perfect 2,Elizabeth Banks,"Anna Kendrick, Rebel Wilson, Hailee Steinfeld,Brittany Snow",6.5,183.44,6081417,38.1386593204775,7099399.0,2351804.0
292,Monsters University,Dan Scanlon,"Billy Crystal, John Goodman, Steve Buscemi, Helen Mirren",7.3,268.49,5163018,12.84393063583815,663680.0,83.0
293,Mechanic: Resurrection,Dennis Gansel,"Jason Statham, Jessica Alba, Tommy Lee Jones,Michelle Yeoh",5.6,21.2,846768,27.79787234042553,9653251.0,159.0
294,Tusk,Kevin Smith,"Justin Long, Michael Parks, Haley Joel Osment,Genesis Rodriguez",5.4,1.82,27576,11.06122448979592,187813.0,3346809.0
295,Atonement,Joe Wright,"Keira Knightley, James McAvoy, Brenda Blethyn,Saoirse Ronan",7.8,50.92,333266,37.2,22060.0,2117.0
296,Harry Potter and the Deathly Hallows: Part 1,David Yates,"Daniel Radcliffe, Emma Watson, Rupert Grint, Bill Nighy",7.7,294.98,9090,30.63414634146341,28809926.0,145.0
297,Shame,Steve McQueen,"Michael Fassbender, Carey Mulligan, James Badge Dale, Lucy Walters",7.2,4.0,62728,14.898989898989901,5434.0,239.0
298,Hanna,Joe Wright,"Saoirse Ronan, Cate Blanchett, Eric Bana, Vicky Krieps",6.8,40.25,269748,20.329545454545453,18176.0,2117.0
299,300: Rise of an Empire,Noam Murro,"Sullivan Stapleton, Eva Green, Lena Headey, Hans Matheson",6.2,106.37,10476627,21.17532467532468,1079579.0,6.0
300,London Has Fallen,Babak Najafi,"Gerard Butler, Aaron Eckhart, Morgan Freeman,Angela Bassett",5.9,62.4,645669,11.091167192429022,502646.0,4.0
301,The Curious Case of Benjamin Button,David Fincher,"Brad Pitt, Cate Blanchett, Tilda Swinton, Julia Ormond",7.8,127.49,1542768,46.36363636363637,18176.0,14330.0
302,Sin City: A Dame to Kill For,Frank Miller,"Mickey Rourke, Jessica Alba, Josh Brolin, Joseph Gordon-Levitt",6.5,13.75,8898,30.494949494949488,9653251.0,371.0
303,The Bourne Ultimatum,Paul Greengrass,"Matt Damon, Edgar Ramírez, Joan Allen, Julia Stiles",8.1,227.14,2561621,22.14583333333333,1419619.0,79.0
304,The Purge: Election Year,James DeMonaco,"Frank Grillo, Elizabeth Mitchell, Mykelti Williamson, Joseph Julian Soria",6.0,79.0,151719,15.368567454798331,10583.0,93.0
305,3 Idiots,Rajkumar Hirani,"Aamir Khan, Madhavan, Mona Singh, Sharman Joshi",8.4,6.52,2459831,15.694174757281553,23042156.0,470919.0
306,Zoolander 2,Ben Stiller,"Ben Stiller, Owen Wilson, Penélope Cruz, Will Ferrell",4.7,28.84,1537427,15.70323434840174,6065177.0,6065177.0
307,World War Z,Marc Forster,"Brad Pitt, Mireille Enos, Daniella Kertesz, James Badge Dale",7.0,202.35,2652554,15.580645161290322,669.0,448.0
308,Mission: Impossible - Ghost Protocol,Brad Bird,"Tom Cruise, Jeremy Renner, Simon Pegg, Paula Patton",7.4,209.36,3365241,24.268656716417908,6730722.0,118457.0
309,Filth,Jon S. Baird,"James McAvoy, Jamie Bell, Eddie Marsan, Imogen Poots",7.1,0.03,57871,22.41567695961995,156009.0,5119.0
310,The Longest Ride,George Tillman Jr.,"Scott Eastwood, Britt Robertson, Alan Alda, Jack Huston",7.1,37.43,863189,30.591338582677164,216451.0,6.0
311,The imposible,J.A. Bayona,"Naomi Watts, Ewan McGregor, Tom Holland, Oaklee Pendergast",7.6,19.0,224751,30.66318719554628,1407798.0,1.0
312,Kick-Ass 2,Jeff Wadlow,"Aaron Taylor-Johnson, Chloë Grace Moretz,Christopher Mintz-Plasse, Jim Carrey",6.6,28.75,65981,20.609756097560968,3276836.0,7077.0
313,Oz the Great and Powerful,Sam Raimi,"James Franco, Michelle Williams, Rachel Weisz, Mila Kunis",6.3,234.9,1289591,16.244137931034484,635.0,94.0
314,Brooklyn,John Crowley,"Saoirse Ronan, Emory Cohen, Domhnall Gleeson,Jim Broadbent",7.5,38.32,63092,83.635838150289,6172.0,355.0
315,Blue Valentine,Derek Cianfrance,"Ryan Gosling, Michelle Williams, John Doman,Faith Wladyka",7.4,9.7,341343,18.88571428571429,2339472.0,281.0
316,Silent Hill,Christophe Gans,"Radha Mitchell, Laurie Holden, Sean Bean,Deborah Kara Unger",6.6,46.98,1578709,25.346820809248552,425.0,4.0
317,Dredd,Pete Travis,"Karl Urban, Olivia Thirlby, Lena Headey, Rachel Wood",7.1,13.4,482889,9.103503184713377,1079579.0,2.0
318,Hunt for the Wilderpeople,Taika Waititi,"Sam Neill, Julian Dennison, Rima Te Wiata, Rachel House",7.9,5.2,96936,31.02255639097744,6507.0,341732.0
319,Big Hero 6,Don Hall,"Ryan Potter, Scott Adsit, Jamie Chung,T.J. Miller",7.8,222.49,2430213,23.60668789808917,192105.0,1272.0
320,Carrie,Kimberly Peirce,"Chloë Grace Moretz, Julianne Moore, Gabriella Wilde, Portia Doubleday",5.9,35.27,1664408,22.399020807833534,3276836.0,10.0
321,Pandorum,Christian Alvart,"Dennis Quaid, Ben Foster, Cam Gigandet, Antje Traue",6.8,10.33,25264,9.724590163934426,226681.0,3.0
322,Olympus Has Fallen,Antoine Fuqua,"Gerard Butler, Aaron Eckhart, Morgan Freeman,Angela Bassett",6.5,98.9,645669,12.950073421439061,502646.0,14.0
323,I Am Number Four,D.J. Caruso,"Alex Pettyfer, Timothy Olyphant, Dianna Agron, Teresa Palmer",6.1,55.09,388309,23.190476190476193,2023739.0,146.0
324,The Proposal,Anne Fletcher,"Sandra Bullock, Ryan Reynolds, Mary Steenburgen,Craig T. Nelson",6.7,163.95,3378631,15.75,10203518.0,5.0
325,Get Hard,Etan Cohen,"Will Ferrell, Kevin Hart, Alison Brie, T.I.",6.0,90.35,262396,18.209177592371873,35118319.0,40.0
326,The Town,Ben Affleck,"Ben Affleck, Rebecca Hall, Jon Hamm, Jeremy Renner",7.6,92.17,3187,22.914956011730204,2918799.0,2918799.0
327,Denial,Mick Jackson,"Rachel Weisz, Tom Wilkinson, Timothy Spall, Andrew Scott",6.6,4.07,15692,1.2649738321380113,2154.0,63.0
328,Goosebumps,Rob Letterman,"Jack Black, Dylan Minnette, Odeya Rush, Ryan Lee",6.3,80.02,445046,24.296296296296298,342725.0,35.0
329,Sherlock Holmes: A Game of Shadows,Guy Ritchie,"Robert Downey Jr., Jude Law, Jared Harris, Rachel McAdams",7.5,186.83,9622284,30.577777777777786,10367606.0,17.0
330,Salt,Phillip Noyce,"Angelina Jolie, Liev Schreiber, Chiwetel Ejiofor, Daniel Olbrychski",6.4,118.31,8787,15.2234273318872,214711.0,42.0
331,Enemy,Denis Villeneuve,"Jake Gyllenhaal, Mélanie Laurent, Sarah Gadon,Isabella Rossellini",6.9,1.01,349,19.966906474820146,30832.0,898.0
332,District 9,Neill Blomkamp,"Sharlto Copley, David James, Jason Cope, Nathalie Boltt",8.0,115.65,1183845,21.612244897959183,785.0,63525.0
333,The Other Guys,Adam McKay,"Will Ferrell, Mark Wahlberg, Derek Jeter, Eva Mendes",6.7,119.22,2236212,27.89693593314763,3825714.0,3.0
334,American Gangster,Ridley Scott,"Denzel Washington, Russell Crowe, Chiwetel Ejiofor,Josh Brolin",7.8,130.13,1693,28.40909090909091,2747744.0,45.0
335,Marie Antoinette,Sofia Coppola,"Kirsten Dunst, Jason Schwartzman, Rip Torn, Judy Davis",6.4,15.96,516,23.271428571428572,493356.0,31.0
336,2012,Roland Emmerich,"John Cusack, Thandie Newton, Chiwetel Ejiofor,Amanda Peet",5.8,166.11,17767089,5.8263888888888875,1700441.0,111343.0
337,Harry Potter and the Half-Blood Prince,David Yates,"Daniel Radcliffe, Emma Watson, Rupert Grint, Michael Gambon",7.5,301.96,11937,81.35,28809931.0,145.0
338,Argo,Ben Affleck,"Ben Affleck, Bryan Cranston, John Goodman, Alan Arkin",7.7,136.02,1293620,7.109826589595376,2918799.0,2918799.0
339,Eddie the Eagle,Dexter Fletcher,"Taron Egerton, Hugh Jackman, Tom Costello, Jo Hartley",7.4,15.79,72381,47.64942528735632,12455721.0,7.0
340,Forgetting Sarah Marshall,Nicholas Stoller,"Kristen Bell, Jason Segel, Paul Rudd, Mila Kunis",7.2,62.88,520,30.02684563758389,2396427.0,24512.0
341,The Giver,Phillip Noyce,"Brenton Thwaites, Jeff Bridges, Meryl Streep, Taylor Swift",6.5,45.09,1180,27.024494142705013,66625.0,42.0
342,Triple 9,John Hillcoat,"Casey Affleck, Chiwetel Ejiofor, Anthony Mackie,Aaron Paul",6.3,12.63,114109,19.693032015065913,541088.0,432.0
343,Angry Birds,Clay Kaytis,"Jason Sudeikis, Josh Gad, Danny McBride, Maya Rudolph",6.3,107.51,1104397,11.106970324361631,348131.0,14878.0
344,Moonrise Kingdom,Wes Anderson,"Jared Gilman, Kara Hayward, Bruce Willis, Bill Murray",7.8,45.51,364180,30.49479166666667,2614.0,4559.0
345,Hairspray,Adam Shankman,"John Travolta, Queen Latifah, Nikki Blonsky,Michelle Pfeiffer",6.7,118.82,2341417,38.253968253968246,8229003.0,292881.0
346,Stake Land,Jim Mickle,"Connor Paolo, Nick Damici, Kelly McGillis, Gregory Jones",6.5,0.02,4633,9.6,697.0,14.0
347,The Book of Eli,Albert Hughes,"Denzel Washington, Mila Kunis, Ray Stevenson, Gary Oldman",6.9,94.82,1357223,16.320987654320987,1221.0,270.0
348,Cloverfield,Matt Reeves,"Mike Vogel, Jessica Lucas, Lizzy Caplan, T.J. Miller",7.0,80.03,534529,17.681818181818183,38190.0,45735.0
349,Under the Skin,Jonathan Glazer,"Scarlett Johansson, Jeremy McWilliams, Lynsey Taylor Mackay, Dougie McConnell",6.3,2.61,94301,7.226130653266332,4352.0,150.0
350,I Am Legend,Francis Lawrence,"Will Smith, Alice Braga, Charlie Tahan, Salli Richardson-Whitfield",7.2,256.39,7800110,36.345238095238095,106921.0,14.0
351,Men in Black 3,Barry Sonnenfeld,"Will Smith, Tommy Lee Jones, Josh Brolin,Jemaine Clement",6.8,179.02,8097855,53.59291338582677,106921.0,285.0
352,Super 8,J.J. Abrams,"Elle Fanning, AJ Michalka, Kyle Chandler, Joel Courtney",7.1,126.98,964302,23.617647058823533,9996.0,1.0
353,Law Abiding Citizen,F. Gary Gray,"Gerard Butler, Jamie Foxx, Leslie Bibb, Colm Meaney",7.4,73.34,1023988,31.50892857142857,4841602.0,1.0
354,Up,Pete Docter,"Edward Asner, Jordan Nagai, John Ratzenberger, Christopher Plummer",8.3,292.98,17651652,10.08125,78438.0,1952.0
